https://www.tripadvisor.com/Hotel_Review-g28970-d295751-Reviews-or1885-Mandarin_Oriental_Washington_DC-Washington_DC_District_of_Columbia.html,"Mandarin Oriental, Washington DC",A Magnificent Oasis near the Heart of it All,"From the gorgeous lobby, to the perfectly appointed rooms, the Mandarin Oriental is an exquisite hotel for when you're looking for something special. I was lucky enough to stay for a wedding and got the wedding rate - not sure how exorbitant it might be...More",146
https://www.tripadvisor.com/Hotel_Review-g28970-d295751-Reviews-or1895-Mandarin_Oriental_Washington_DC-Washington_DC_District_of_Columbia.html,None,yuck...not impressed,"Don't waste your hard earned money.

This review is for a suite and for a basic city view room.   In my suite, the bottom of my feet were DIRTY after just an hour...COVERED SOLID BLACK WITH DIRT from the gross carpet.  YUCK!  

I was expecting...More",3
https://www.tripadvisor.com/Hotel_Review-g28970-d295751-Reviews-or1915-Mandarin_Oriental_Washington_DC-Washington_DC_District_of_Columbia.html,"Mandarin Oriental, Washington DC","Rooms are surprising pretty basic, but the bathrooms are nice.","This being the Mandarin Oriental, I expected much more from the rooms. To tell you the truth, if I had been brought into the hotel blindfolded, I NEVER would have guessed that I was in the Mandarin.  The rooms actually reminded me of Hilton Garden...More",14
https://www.tripadvisor.com/Hotel_Review-g28970-d295751-Reviews-or1930-Mandarin_Oriental_Washington_DC-Washington_DC_District_of_Columbia.html,"Mandarin Oriental, Washington DC",Nice Hotel - Don't Get the City View,"We booked through Expedia for the Cherry Blossom Festival. The City View option was slightly less, but the view is not of the city! Our room had some train tracks in the back that ran through an abandoned parking lot. Really awful! So we paid...More",1
https://www.tripadvisor.com/Hotel_Review-g28970-d295751-Reviews-or1950-Mandarin_Oriental_Washington_DC-Washington_DC_District_of_Columbia.html,"Mandarin Oriental, Washington DC",We have had several outstanding stays at the Mandarin,"We have stayed at the Mandarin several times during trips to D.C., and, even though the hotel is not located conveniently located near D.C. attractions, we generally use a cab to get around D.C. and it is not any more expensive to get to theaters...More",112
https://www.tripadvisor.com/Hotel_Review-g28970-d295751-Reviews-or1955-Mandarin_Oriental_Washington_DC-Washington_DC_District_of_Columbia.html,"Mandarin Oriental, Washington DC",I understand the complaints about the staff,We spent one night at this hotel because we were dining at CityZen -- one of our favorite restaurants in the US.  I splurged by reserving a corner room with a river view to enjoy before and after dinner.  They didn't have any of those...More,43
https://www.tripadvisor.com/Hotel_Review-g28970-d295751-Reviews-or1965-Mandarin_Oriental_Washington_DC-Washington_DC_District_of_Columbia.html,"Mandarin Oriental, Washington DC",Great place to spend a blizzard,"I was somewhat of a captive audience -- DC was shut down due to the storm and I couldn't even get back to my car (at a metro station).  Accommodations were sumptuous, the shower -- to die for.  Seriously, I averaged 3 showers per day,...More",37
https://www.tripadvisor.com/Hotel_Review-g28970-d295751-Reviews-or1990-Mandarin_Oriental_Washington_DC-Washington_DC_District_of_Columbia.html,"Mandarin Oriental, Washington DC",Not as Bad as Some Reviews - Quite Good,"Stayed at the MO in DC overnight midweek. The bell staff were incredibly gracious, after chatting on the way to our room our bellman called the front desk and asked for a better room. A better room was provided promptly. The bellman did this on...More",158
https://www.tripadvisor.com/Hotel_Review-g28970-d295751-Reviews-or2000-Mandarin_Oriental_Washington_DC-Washington_DC_District_of_Columbia.html,"Mandarin Oriental, Washington DC",Elegance,"Stayed in this hotel for a few nights - the room was very spacious with a nice view of the Jefferson Memorial. As typifies this level of luxury spacious bathroom offerred separate shower with nice Gilbert and Soames Amenities. 
There is a beautiful Spa in...More",175
https://www.tripadvisor.com/Hotel_Review-g28970-d295751-Reviews-or2000-Mandarin_Oriental_Washington_DC-Washington_DC_District_of_Columbia.html,"Mandarin Oriental, Washington DC","Great Service, watch out for Spa Cancellation","The Mandarin Oriental has excellent service from the minute you arrive, to when you get to your room.  As an 18-year old, I have grown to expect a certain level of discrimination especially in five-star hotels.  This hotel, not only treated me like a king,...More",21
https://www.tripadvisor.com/Hotel_Review-g28970-d295751-Reviews-or2025-Mandarin_Oriental_Washington_DC-Washington_DC_District_of_Columbia.html,"Mandarin Oriental, Washington DC",Expensive All Around,"My daughter and I stayed at the Mandarin Oriental 2 nites in March 2008 and were expecting the world considering its high price and five diamond rating.
     When you first arrive you are greeted by the doorman who will willingly help you with your baggage...More",3
https://www.tripadvisor.com/Hotel_Review-g28970-d295751-Reviews-or2060-Mandarin_Oriental_Washington_DC-Washington_DC_District_of_Columbia.html,"Mandarin Oriental, Washington DC",One of the nicest hotels,"The Mandarin Oriental in DC is such an amazing hotel.  Beautiful lobby and rooms.  I only wish I didn't have to go to work so I could spend all day in the room and soaking in the tub.  The bathroom is wonderful, huge with a...More",16
https://www.tripadvisor.com/Hotel_Review-g28970-d295751-Reviews-or2120-Mandarin_Oriental_Washington_DC-Washington_DC_District_of_Columbia.html,"Mandarin Oriental, Washington DC",,More,20
https://www.tripadvisor.com/Hotel_Review-g28970-d125476-Reviews-or15-Fairfield_Inn_Suites_by_Marriott_Washington_DC_Downtown-Washington_DC_District_of_Columb.html,"Fairfield Inn & Suites by Marriott Washington, DC/Downtown",Rough but decent,"Appears to be a very busy hotel. Friendly staff. Free breakfast. Good location in Chinatown. Very close to other things you may want to see in DC and metro stop. Historic Site used to be an old hospital, which explains some of the mall, quirky...More",110
https://www.tripadvisor.com/Hotel_Review-g28970-d125476-Reviews-or30-Fairfield_Inn_Suites_by_Marriott_Washington_DC_Downtown-Washington_DC_District_of_Columb.html,"Fairfield Inn & Suites by Marriott Washington, DC/Downtown","Good location, No view","No view of Chinatown, just a Gray Building alley view. Bland and cold breakfast, No place to sit. Lobby coffee station is not 24 hours and only Bold selection available. Comfy beds and room clean. Bathroom tub very slippery, No non slip strips. Light bulb...More",47
https://www.tripadvisor.com/Hotel_Review-g28970-d125476-Reviews-or35-Fairfield_Inn_Suites_by_Marriott_Washington_DC_Downtown-Washington_DC_District_of_Columb.html,"Fairfield Inn & Suites by Marriott Washington, DC/Downtown","NY , DC visit","It was a overland trip about 13 hour drive. Vehicle Enterprises provided  fantastic, schedule was reluctant. We could change the itirerary  as needed. Wow !!1 weather was awesome. Thanks for the arrangement SWEDE ADVENTURES FOR THIS ARRANGEMENT.",2
https://www.tripadvisor.com/Hotel_Review-g28970-d125476-Reviews-or40-Fairfield_Inn_Suites_by_Marriott_Washington_DC_Downtown-Washington_DC_District_of_Columb.html,"Fairfield Inn & Suites by Marriott Washington, DC/Downtown",Location is fantastic,"The service and location truly make up for the lack luster room. The people here were really nice and really try to accomodate your every need. That being said, the $150 price point isnt reflected in your room. The tv is at least 10 years...More",3
https://www.tripadvisor.com/Hotel_Review-g28970-d125476-Reviews-or70-Fairfield_Inn_Suites_by_Marriott_Washington_DC_Downtown-Washington_DC_District_of_Columb.html,"Fairfield Inn & Suites by Marriott Washington, DC/Downtown",Good location,"Right in Chinatown near restaurants, shops and Metro station. I'm 62 and enjoyed a nice 15 minute walk from Union Station to the hotel. The complimentary breakfast had something for everyone. Room was clean but very surprised that it didn't have a small refrigerator. Other...More",47
https://www.tripadvisor.com/Hotel_Review-g28970-d125476-Reviews-or80-Fairfield_Inn_Suites_by_Marriott_Washington_DC_Downtown-Washington_DC_District_of_Columb.html,"Fairfield Inn & Suites by Marriott Washington, DC/Downtown","Great place, convenient location ","Only less than a mile from the national mall, this hotel was a really convenient location for visiting all the typical tourist spots for D.C. (the must sees). Located in Chinatown, there's plenty to eat, plus the restaurant in the hotel is lovely. 

The rooms...More",41
https://www.tripadvisor.com/Hotel_Review-g28970-d125476-Reviews-or100-Fairfield_Inn_Suites_by_Marriott_Washington_DC_Downtown-Washington_DC_District_of_Columb.html,"Fairfield Inn & Suites by Marriott Washington, DC/Downtown","GREAT LOCATION, HELPFUL STAFF, STAY HERE! DETAILS","Yes at first I wondered, hmmm? Should we really stay in Chinatown, Ive never been to Chinatown in DC and wondered to myself how ""shady"" it might be.
Don't think twice about it, it has so much to offer!  Its more trendy and upscale than...More",69
https://www.tripadvisor.com/Hotel_Review-g28970-d125476-Reviews-or105-Fairfield_Inn_Suites_by_Marriott_Washington_DC_Downtown-Washington_DC_District_of_Columb.html,"Fairfield Inn & Suites by Marriott Washington, DC/Downtown","European sized room, tinier closet","Gold member, checked in online 24 hours in advance and called morning of arrival  to request room near elevator and extra towels. Arrived and was given the room furthest from the elevator in the tiniest room I have seen in N America. I went to...More",8
https://www.tripadvisor.com/Hotel_Review-g28970-d125476-Reviews-or165-Fairfield_Inn_Suites_by_Marriott_Washington_DC_Downtown-Washington_DC_District_of_Columb.html,"Fairfield Inn & Suites by Marriott Washington, DC/Downtown",Loved the location and staff,This hotel is well situated (H & 5th NW) for what we wanted to see .  It borders Chinatown and there are some great restaurants waiting to serve you.  It's a 2 block walk to the Metro and about a six block walk to Pennsylvania...More,142
https://www.tripadvisor.com/Hotel_Review-g28970-d125476-Reviews-or170-Fairfield_Inn_Suites_by_Marriott_Washington_DC_Downtown-Washington_DC_District_of_Columb.html,"Fairfield Inn & Suites by Marriott Washington, DC/Downtown",Friendly & Clean,Stayed for one night. Nice clean functional room. I got a king room on the corner so I had windows on t walls which was nice. Located in Chinatown. I found cheaper parking 10 minute walk away. The breakfast  was a pretty typical free hotel...More,15
https://www.tripadvisor.com/Hotel_Review-g28970-d125476-Reviews-or170-Fairfield_Inn_Suites_by_Marriott_Washington_DC_Downtown-Washington_DC_District_of_Columb.html,"Fairfield Inn & Suites by Marriott Washington, DC/Downtown",Met all criteria,"""Three girl trip"" to Washington DC...we had three criteria: Queen size bed (or two plus roll away), free breakfast an a view (there was a beautiful church that we looked upon). The Fairfield met them all plus it was close to the Metro and the...More",19
https://www.tripadvisor.com/Hotel_Review-g28970-d125476-Reviews-or180-Fairfield_Inn_Suites_by_Marriott_Washington_DC_Downtown-Washington_DC_District_of_Columb.html,"Fairfield Inn & Suites by Marriott Washington, DC/Downtown","Very friendly and accommodating staff, good location","I was booked into this hotel through a conference I attended in DC. The hotel was about a mile walk from the meeting location which took me through part of Chinatown. From the minute I walked in until the day I checked out, the staff...More",106
https://www.tripadvisor.com/Hotel_Review-g28970-d125476-Reviews-or180-Fairfield_Inn_Suites_by_Marriott_Washington_DC_Downtown-Washington_DC_District_of_Columb.html,"Fairfield Inn & Suites by Marriott Washington, DC/Downtown",Comfortable & Conveniently located for Sightseeing,"Pros: (1) Great staff: everyone, from maintenance, staff in the breakfast area, front desk, & concierge, were friendly, welcoming & helpful = came across like a family 
(2) Excellent location: DCA to hotel via Metro a quick trip; Gallery Pl Metro minutes from hotel; hotel...More",116
https://www.tripadvisor.com/Hotel_Review-g28970-d125476-Reviews-or185-Fairfield_Inn_Suites_by_Marriott_Washington_DC_Downtown-Washington_DC_District_of_Columb.html,"Fairfield Inn & Suites by Marriott Washington, DC/Downtown","Very good hotel, nice location, with recommendation ","Fairfield Inn & Suites is nicely located in Washington Chinatown. Close to major tourists attractions and easily accessible with METRO.
I was happy with my stay and worth the price paid.
Clean, well maintained, friendly staff.
Will stay there again and I can give my...More",45
https://www.tripadvisor.com/Hotel_Review-g28970-d125476-Reviews-or190-Fairfield_Inn_Suites_by_Marriott_Washington_DC_Downtown-Washington_DC_District_of_Columb.html,"Fairfield Inn & Suites by Marriott Washington, DC/Downtown",3 day site-seeing trip,Location is on edge of Chinatown. LOTS of homeless people in the area which made us feel a little apprehensive about going out for dinner in the evenings so we opted for the so-so Irish Chanel pub which is attached to hotel. Found the hotel...More,27
https://www.tripadvisor.com/Hotel_Review-g28970-d125476-Reviews-or195-Fairfield_Inn_Suites_by_Marriott_Washington_DC_Downtown-Washington_DC_District_of_Columb.html,"Fairfield Inn & Suites by Marriott Washington, DC/Downtown","Comfortable, convenient to city attractions","It is a walk of less than ten minutes from the Gallery Place Metro station. You are greeted by the folks at the desk the minute you walk through the door-every time you walk in, in fact. They wish you a good day, when you...More",259
https://www.tripadvisor.com/Hotel_Review-g28970-d125476-Reviews-or230-Fairfield_Inn_Suites_by_Marriott_Washington_DC_Downtown-Washington_DC_District_of_Columb.html,"Fairfield Inn & Suites by Marriott Washington, DC/Downtown",It's the people that set this hotel apart!,"You know what you're getting at a Fairfield Inn, right? Not too fancy, but clean, efficient, budget friendly and that easy in and out full breakfast.  That's what I was expecting for the SHRM conference in DC. 
Service is impeccable. From the front desk to...More",30
https://www.tripadvisor.com/Hotel_Review-g28970-d125476-Reviews-or235-Fairfield_Inn_Suites_by_Marriott_Washington_DC_Downtown-Washington_DC_District_of_Columb.html,"Fairfield Inn & Suites by Marriott Washington, DC/Downtown",Memorial Day Weekend Getaway,"The Fairfield Inn and Suites, H Street, Washington, DC is located right in the heart of everything. Great choice when visiting DC. Walk, Metro, Uber. Great value. Breakfast included. Good hot food!

Angie is the concierge. A wealth of knowledge and a real nice person....More",123
https://www.tripadvisor.com/Hotel_Review-g28970-d125476-Reviews-or240-Fairfield_Inn_Suites_by_Marriott_Washington_DC_Downtown-Washington_DC_District_of_Columb.html,"Fairfield Inn & Suites by Marriott Washington, DC/Downtown","Nice location, nice staff, serviceable hotel","The Fairfield Inn is conveniently located near Chinatown.  It is close to Metro and walking to many downtown sites is reasonable, but not trivial.  The hotel has no views of the city sites.  My room faces the ally that separates it from the next building....More",182
https://www.tripadvisor.com/Hotel_Review-g28970-d125476-Reviews-or245-Fairfield_Inn_Suites_by_Marriott_Washington_DC_Downtown-Washington_DC_District_of_Columb.html,None,Comfy beds and great location,"Loved it here! The staff is friendly and the Metro, Verizon Centre, the Regal Cinemas and restaurants are close by. The hotel was clean brightly lit and nice view from the room. There is free wifi and a business centre. No pool but they did...More",24
https://www.tripadvisor.com/Hotel_Review-g28970-d125476-Reviews-or255-Fairfield_Inn_Suites_by_Marriott_Washington_DC_Downtown-Washington_DC_District_of_Columb.html,"Fairfield Inn & Suites by Marriott Washington, DC/Downtown",Great hotel in a good location,Stayed at this hotel for 3 nights while on business. I took the metro from the airport and was surprised to find that the hotel was only a few minutes walk from the metro station and right on the edge of Chinatown. That means easy...More,166
https://www.tripadvisor.com/Hotel_Review-g28970-d125476-Reviews-or260-Fairfield_Inn_Suites_by_Marriott_Washington_DC_Downtown-Washington_DC_District_of_Columb.html,None,Overall average stay at Fairfield Inn & Suites,My family and I enjoyed our stay at Fairfield Inn & Suites but overall it was an average hotel. I think one thing we found frustrating is that although the staff were friendly and welcoming. The area around the metro near there is not as...More,245
https://www.tripadvisor.com/Hotel_Review-g28970-d125476-Reviews-or265-Fairfield_Inn_Suites_by_Marriott_Washington_DC_Downtown-Washington_DC_District_of_Columb.html,"Fairfield Inn & Suites by Marriott Washington, DC/Downtown",Outstanding hotel staff!,We have stayed at many hotels over years traveling for business and pleasure.  This trip was for my wife's birthday. From the moment we pulled up to the valet parking and were warmly greeted by Lauren and we knew we had chosen a great place...More,8
https://www.tripadvisor.com/Hotel_Review-g28970-d125476-Reviews-or290-Fairfield_Inn_Suites_by_Marriott_Washington_DC_Downtown-Washington_DC_District_of_Columb.html,"Fairfield Inn & Suites by Marriott Washington, DC/Downtown",Above average hotel near lots of things,"A  nice place to stay near a lot of things (Gallery Place, Verizon Center, Convention center).  My king room also had a sofa bed in it.  The breakfast downstairs was below average for those sort of things.  The lobby space is a bit cramped and...More",2
https://www.tripadvisor.com/Hotel_Review-g28970-d125476-Reviews-or290-Fairfield_Inn_Suites_by_Marriott_Washington_DC_Downtown-Washington_DC_District_of_Columb.html,"Fairfield Inn & Suites by Marriott Washington, DC/Downtown",5 Star Stay!,I am a Marriott Rewards member so I always look there first and booked this room a couple of months ago for our one day stay in DC. The location is perfect...close to all of the sights. Our great experience started with the Valet gal...More,252
https://www.tripadvisor.com/Hotel_Review-g28970-d125476-Reviews-or315-Fairfield_Inn_Suites_by_Marriott_Washington_DC_Downtown-Washington_DC_District_of_Columb.html,"Fairfield Inn & Suites by Marriott Washington, DC/Downtown",Perfect ,"We could not ask for a better experience on our first visit to Washington DC. Hotel is in 
a great location. Close to the Verizon Centre, shopping and only 10 min walk to the White House etc. Housekeeping, front desk, cafeteria, tour guild (front desk)...More",62
https://www.tripadvisor.com/Hotel_Review-g28970-d125476-Reviews-or365-Fairfield_Inn_Suites_by_Marriott_Washington_DC_Downtown-Washington_DC_District_of_Columb.html,"Fairfield Inn & Suites by Marriott Washington, DC/Downtown",Clean rooms and pleasant staff,"Valet parking, clean lobby, pleasant staff, and the room was extremely clean and comfortable and quite larger than I expected.  They also have free breakfast which is always nice when traveling on business.  I wouldn't hesitate to stay here again.  It was very convenient.More",142
https://www.tripadvisor.com/Hotel_Review-g28970-d125476-Reviews-or365-Fairfield_Inn_Suites_by_Marriott_Washington_DC_Downtown-Washington_DC_District_of_Columb.html,"Fairfield Inn & Suites by Marriott Washington, DC/Downtown",Fantastic property with great service,We arrived early at Reagan International and took the subway directly to the hotel.  This airport is close and to the city and has easy metro options.  We were pleasantly surprised to find the hotel subway stop only 2 blocks away.  Very convenient and fast!...More,22
https://www.tripadvisor.com/Hotel_Review-g28970-d125476-Reviews-or370-Fairfield_Inn_Suites_by_Marriott_Washington_DC_Downtown-Washington_DC_District_of_Columb.html,None,Excellent hotel in walking distance to the Verizon Center,"Stayed here with family to catch a Wizards basketball game.  We had a small studio room with a king-sized bed on one side and a pull-out couch on the other.  A small wall separated the two areas but both sides had a TV, which was...More",101
https://www.tripadvisor.com/Hotel_Review-g28970-d125476-Reviews-or390-Fairfield_Inn_Suites_by_Marriott_Washington_DC_Downtown-Washington_DC_District_of_Columb.html,"Fairfield Inn & Suites by Marriott Washington, DC/Downtown",Great location for a weekend in DC,We stayed at this location for a long weekend. Staff was personable and helpful! We had a room on the 10th floor with a nice view and little road noise. Room was clean and comfortable. Breakfast was better than expected with many choices! This hotel...More,20
https://www.tripadvisor.com/Hotel_Review-g28970-d125476-Reviews-or400-Fairfield_Inn_Suites_by_Marriott_Washington_DC_Downtown-Washington_DC_District_of_Columb.html,"Fairfield Inn & Suites by Marriott Washington, DC/Downtown","Nice location, friendly employees",We stayed here because it was near our son's apartment. It fits in nicely with Chinatown and its environs. The lobby is nicely decorated with an Asian motif. Check out the wall by the computer/business center--there are silver replicas of fortune cookies and they really...More,186
https://www.tripadvisor.com/Hotel_Review-g28970-d125476-Reviews-or405-Fairfield_Inn_Suites_by_Marriott_Washington_DC_Downtown-Washington_DC_District_of_Columb.html,"Fairfield Inn & Suites by Marriott Washington, DC/Downtown",It's OK ,"This is not a 5 star hotel and it doesn't pretend to be. The staff is friendly and professional, our room (while small) was clean and laid out well. Now for the bad. The valet parking is $26 per night and the valets have to...More",268
https://www.tripadvisor.com/Hotel_Review-g28970-d125476-Reviews-or420-Fairfield_Inn_Suites_by_Marriott_Washington_DC_Downtown-Washington_DC_District_of_Columb.html,"Fairfield Inn & Suites by Marriott Washington, DC/Downtown",Great Stay,Spent two days at this hotel. What a great place! They were able to let us check in early do we could go see the City. Great breakfast with Eggs bacon and sausage on the next day. Room was fantastic!! Very clean modern with lots...More,92
https://www.tripadvisor.com/Hotel_Review-g28970-d125476-Reviews-or430-Fairfield_Inn_Suites_by_Marriott_Washington_DC_Downtown-Washington_DC_District_of_Columb.html,"Fairfield Inn & Suites by Marriott Washington, DC/Downtown",Recommended because of the location,"This hotel has a great location, good price to have the Washington Mall attractions just some blocks away, specially the Smithsonian Natural History museum. 
The Chinatown stores around the hotel give a good feeling.The famous arch is located just 1 block. Also the Verizon Center...More",34
https://www.tripadvisor.com/Hotel_Review-g28970-d125476-Reviews-or450-Fairfield_Inn_Suites_by_Marriott_Washington_DC_Downtown-Washington_DC_District_of_Columb.html,"Fairfield Inn & Suites by Marriott Washington, DC/Downtown","Nice hotel, great staff!",We recently spent 2 nights there and the lobby and room were beautiful and clean.  I chose the hotel because it is a great location about a block to the metro and only 6 blocks to the National Mall.  We arrived early and were immediately...More,7
https://www.tripadvisor.com/Hotel_Review-g28970-d125476-Reviews-or460-Fairfield_Inn_Suites_by_Marriott_Washington_DC_Downtown-Washington_DC_District_of_Columb.html,"Fairfield Inn & Suites by Marriott Washington, DC/Downtown",Absolutely Excellent Hotel at an Excellent Location,"This is really an excellent hotel.  Reservation staff stayed in contact with me before arrival, check-in and check out were excellent. 
The room was very nice and I did not have a single complaint for my entire 3 night stay. Staff very pleasant, the breakfast...More",60
https://www.tripadvisor.com/Hotel_Review-g28970-d125476-Reviews-or465-Fairfield_Inn_Suites_by_Marriott_Washington_DC_Downtown-Washington_DC_District_of_Columb.html,"Fairfield Inn & Suites by Marriott Washington, DC/Downtown",Staff very helpful,We stayed here for two nights and were very happy with our choice.  The hotel is located in Chinatown with a few nice restaurants in the area.  The National Mall was a fairly easy 15min walk away which was one of the reasons I chose...More,56
https://www.tripadvisor.com/Hotel_Review-g28970-d125476-Reviews-or565-Fairfield_Inn_Suites_by_Marriott_Washington_DC_Downtown-Washington_DC_District_of_Columb.html,"Fairfield Inn & Suites by Marriott Washington, DC/Downtown",Serviceable but better options out there...,"Finishing up our 2-week trip was a short drive from NYC to Washington DC which saw us stay at the Fairfield Inn for 2 nights. Located in the heart of Chinatown, the hotel is just 1-2 minute walk from the Verizon Center and the other...More",115
https://www.tripadvisor.com/Hotel_Review-g28970-d125476-Reviews-or575-Fairfield_Inn_Suites_by_Marriott_Washington_DC_Downtown-Washington_DC_District_of_Columb.html,"Fairfield Inn & Suites by Marriott Washington, DC/Downtown","Perfect Stay - Good Price, Location, Service & Lodging",I stayed here for 2 nights to reunite with a friend and see my daughter play a college soccer tournament at Catholic University. I knew I would not have transportation so I relied on this hotel to be convenient for me arriving in Dulles Int'l...More,11
