https://www.tripadvisor.com/Hotel_Review-g28970-d84058-Reviews-or2420-The_Dupont_Circle-Washington_DC_District_of_Columbia.html,The Dupont Circle,"Great location, great value, cool rooms and excellent service.","First, I can't believe we received such a great rate for this hotel, located across the street from Dupont Circle and about a block away from the Metro station.  No need for taxis or airport shuttles.
Everything you need is close by...restaurants, CVS store, Starbucks,...More",36
https://www.tripadvisor.com/Hotel_Review-g28970-d84058-Reviews-or2510-The_Dupont_Circle-Washington_DC_District_of_Columbia.html,The Dupont Circle,"Great hotel, great location","My husband and I chose to stay in DC to sight-see after dropping our son off at college. I chose this hotel for a 3 night stay based on trip advisor reviews, location and the fact that they offered a parking package.  The hotel exceeded...More",118
https://www.tripadvisor.com/Hotel_Review-g28970-d84058-Reviews-or2525-The_Dupont_Circle-Washington_DC_District_of_Columbia.html,The Dupont Circle,Excellent central hotel,Excellent central hotel in the heart of Washington dc. Right next to the Dupont circle area where there are plenty of bars/cafes. Be aware especially through the week most places stop serving food between 10pm and 11pm and the hotel didnt offer room service after...More,22
https://www.tripadvisor.com/Hotel_Review-g28970-d84058-Reviews-or2525-The_Dupont_Circle-Washington_DC_District_of_Columbia.html,The Dupont Circle,Great location,PROS: You really cannot beat the location of this hotel.  It is a block away from the Metro.  It is surrounded by excellent restaurants and nightlife (including a restaurant and bar in the hotel itself that we did not try).  The staff is friendly and...More,166
https://www.tripadvisor.com/Hotel_Review-g28970-d84058-Reviews-or2555-The_Dupont_Circle-Washington_DC_District_of_Columbia.html,The Dupont Circle,1 week long conference,"My employer booked our annual managers conference at this hotel. My stay consisted of 4 nights. The room was very comfy, modern and all my needs were met. A lot of extras are provided, ex: eye shades, that normally aren't thought of at run of...More",85
https://www.tripadvisor.com/Hotel_Review-g28970-d84058-Reviews-or2575-The_Dupont_Circle-Washington_DC_District_of_Columbia.html,The Dupont Circle,"Favorite hotel in Washington, DC","Stayed at the Dupont Circle Hotel in late June during my 25th wedding anniversary. The check-in was effortless. The front desk personnel was professional, efficient and helpful. The hotel has been completely renovated since my last visit. The look is sophisticated and welcoming. The room...More",11
https://www.tripadvisor.com/Hotel_Review-g28970-d84058-Reviews-or2580-The_Dupont_Circle-Washington_DC_District_of_Columbia.html,The Dupont Circle,"Great Location, Small Rooms...",The best thing about the Dupont Circle Hotel is the location! The hotel is in a lovely area and close to the Dupont Circle Metro. We enjoyed our stay but the rooms are a bit on the small side (for two adults and two kids)....More,105
https://www.tripadvisor.com/Hotel_Review-g28970-d84058-Reviews-or2635-The_Dupont_Circle-Washington_DC_District_of_Columbia.html,None,"Excellent location, good service","Just spent 4 nights at The DuPont Circle. 
**Good:
->Location is super convenient. There are many (good) restaurants and coffee shops within walking distance.  There is a CVS right around the corner that is open 24 hrs. A Starbucks across the street. The metro station...More",33
https://www.tripadvisor.com/Hotel_Review-g28970-d84058-Reviews-or2665-The_Dupont_Circle-Washington_DC_District_of_Columbia.html,The Dupont Circle,"Modern, Clean & Well Appointed Room + Great Customer Service!! A+++","I'm extremely critical in all my reviews as Trip Advisor has served me abounds for the past 10yrs now its time to pay it forward. This was my second stay here, my first was several years ago & only for one night this time it...More",73
https://www.tripadvisor.com/Hotel_Review-g28970-d84058-Reviews-or2760-The_Dupont_Circle-Washington_DC_District_of_Columbia.html,The Dupont Circle,Great location-friendly staff.,"I stayed at the Dupont Circle Hotel in mid-January, just after Inauguration Day.The hotel is in a terrific location-15 minutes walk to White House, you can walk to Georgetown, or back.Bus and Metro transportation is a 2 minute walk away from the door of the...More",7
https://www.tripadvisor.com/Hotel_Review-g28970-d84058-Reviews-or2805-The_Dupont_Circle-Washington_DC_District_of_Columbia.html,The Dupont Circle,Luxury for a great price!!!,I stayed at the Level 9 suites at the Hotel Dupont for New Year's Eve.  It was an excellent experience.  The room was beautiful and the service was top flight.  I would recommend the experience to anyone who loves luxury and quality.  SN:  The brunch...More,5
https://www.tripadvisor.com/Hotel_Review-g28970-d84058-Reviews-or2805-The_Dupont_Circle-Washington_DC_District_of_Columbia.html,The Dupont Circle,Best Stay in DC,"My husband and I recently had the pleasure of staying at the Dupont Circle Hotel this New Year's Eve.  Let me give you a brief run down of our AMAZING stay.

Staff: 
Upon arrival I was a little nervous based on some of the review...More",6
https://www.tripadvisor.com/Hotel_Review-g28970-d84058-Reviews-or2855-The_Dupont_Circle-Washington_DC_District_of_Columbia.html,The Dupont Circle,Highly recommend,"Great location and awesome hotel.  Rooms are perfect for one or two people.  Staff was fantastic and bar scene was a lot of fun for a couple drinks at the end of the day. 

Was in town for business Friday to Tuesday and had very...More",11
https://www.tripadvisor.com/Hotel_Review-g28970-d84058-Reviews-or2860-The_Dupont_Circle-Washington_DC_District_of_Columbia.html,The Dupont Circle,Very happily surprised!,"The Dupont Circle Hotel was a designated ""overflow"" hotel for our annual conference up the street.  Thought I would enjoy being closer to the Metro station - and didn't really have any other real expectations one way or the other.  Wow!  I was SO impressed...More",1
https://www.tripadvisor.com/Hotel_Review-g28970-d84058-Reviews-or2895-The_Dupont_Circle-Washington_DC_District_of_Columbia.html,The Dupont Circle,Have a great time,"I was stay one night and 2days at Dupont circle hotel! got help from hotel respection staff  the way 
to IAD and nice bar!
I was stay one night and 2days at Dupont circle hotel! got help from hotel respection staff  the way to IAD...More",10
https://www.tripadvisor.com/Hotel_Review-g28970-d84058-Reviews-or2900-The_Dupont_Circle-Washington_DC_District_of_Columbia.html,The Dupont Circle,Excellent location!,"Stayed for 5 nights in October after getting a really good deal. First of all, the location is great, close to the metro, a CVS, Starbucks, parks, museums, cafés and restaurants. The hotel has a nice welcoming athmosphere with friendly staff at the door and...More",55
https://www.tripadvisor.com/Hotel_Review-g28970-d84058-Reviews-or2910-The_Dupont_Circle-Washington_DC_District_of_Columbia.html,The Dupont Circle,Modern decor and fabulous guest experience,I was absolutely thrilled when we walked into this hotel because from the moment we arrived I knew it would be a fabulous stay.  The hotel is centrally located and very convenient access to transportation or walking distance to shops and restaurants.  The decor was...More,44
https://www.tripadvisor.com/Hotel_Review-g28970-d84058-Reviews-or2925-The_Dupont_Circle-Washington_DC_District_of_Columbia.html,The Dupont Circle,Not bad but I would prefer to stay elsewhere,"The strongest positive factor is an excellent location, right on Dupont Circle surrounded by restaurants, bars, bookstores, a drugstore, etc. and next to the Metro Red Line. Had a Deluxe Room on 8th floor w/ large (unable to open) windows that gave  room a nice...More",179
https://www.tripadvisor.com/Hotel_Review-g28970-d84058-Reviews-or2935-The_Dupont_Circle-Washington_DC_District_of_Columbia.html,The Dupont Circle,Good boutique hotel,I stayed in DC this spring for a convention trip and booked at the Dupont Circle thru the internet. The only snag I had at the hotel was that when I arrived the king room that I had reserved and paid for was not made...More,126
https://www.tripadvisor.com/Hotel_Review-g28970-d84058-Reviews-or3010-The_Dupont_Circle-Washington_DC_District_of_Columbia.html,The Dupont Circle,DuPont is DuPlace!,"We arrived at the front desk with four of us -- two adults and two teenage kids to find out that our single room with a king bed wouldn't accommodate a roll-away.  The young lady at the front desk looked puzzled briefly, but then very...More",15
https://www.tripadvisor.com/Hotel_Review-g28970-d84058-Reviews-or3025-The_Dupont_Circle-Washington_DC_District_of_Columbia.html,The Dupont Circle,Absolutely excellent,"Booked a king for 2 nights with hotel website and given a complimentary upgrade to a level 9 suite with balcony - stunning. Full complimentary bar was the  best I have seen, huge room with everything you would want. Your room key is needed to...More",96
https://www.tripadvisor.com/Hotel_Review-g28970-d84058-Reviews-or3030-The_Dupont_Circle-Washington_DC_District_of_Columbia.html,The Dupont Circle,Lux room in a fantastic location!,We travel to DC quite often and had not spent much time in the Dupont neighborhood until this trip.  We were impressed with the area and the hotel.  The valet brought our luggage to our room immediately after check in.  I'm surprised by what other...More,29
https://www.tripadvisor.com/Hotel_Review-g28970-d84058-Reviews-or3080-The_Dupont_Circle-Washington_DC_District_of_Columbia.html,None,Beautiful hotel in a beautiful part of the city!,"I stayed here for business use but also had the opportunity to enjoy myself here.  The check in was quick and easy and the hotel staff were friendly and helpful, I had a lot of luggage with me at the time which they handled.
The...More",23
https://www.tripadvisor.com/Hotel_Review-g28970-d84058-Reviews-or3095-The_Dupont_Circle-Washington_DC_District_of_Columbia.html,None,Great Location,"The Dupont at the Circle worked out great for me. It was close to the business I had to do. The room was comfortable, free internet, nice bar down stairs.
The bathroom was clean and quite stylish, European feel. It had a great walking in...More",278
https://www.tripadvisor.com/Hotel_Review-g28970-d84058-Reviews-or3100-The_Dupont_Circle-Washington_DC_District_of_Columbia.html,The Dupont Circle,Unless you get a groupon it's not worth the money.,We came to the DuPont Circle because of a groupon we purchased. I would never pay full price for this hotel. There is no coffee in the room and the view from our room is all roof and other rooms. It is the coldest temps...More,5
https://www.tripadvisor.com/Hotel_Review-g28970-d84058-Reviews-or3105-The_Dupont_Circle-Washington_DC_District_of_Columbia.html,The Dupont Circle,"Stylish and inviting, elegant and chic, this hotel manages the tricky balancing act of being both modern and warm","If there’s one thing you want on one of the windiest and coldest nights Washington, DC has seen this year, it’s a heated bathroom floor. Having never had the pleasure of experiencing one until my recent stay at the Dupont Circle Hotel, I can whole-heartedly...More",146
https://www.tripadvisor.com/Hotel_Review-g28970-d84058-Reviews-or3105-The_Dupont_Circle-Washington_DC_District_of_Columbia.html,The Dupont Circle,Nice hotel in convenient DuPont Circle location,"The main reason for choosing this hotel was its location on the red line. The hotel has recently been overhauled in a smart decor. The hotel bar was very busy in the evenings, and the hotel is nearby many excellent nearby restaurants. I recommend staying...More",90
https://www.tripadvisor.com/Hotel_Review-g28970-d84058-Reviews-or3130-The_Dupont_Circle-Washington_DC_District_of_Columbia.html,The Dupont Circle,Excellent stay at Level 9,"We stayed at Level Nine of the Dupont Circle Hotel for New Year 2011.

The hotel is well located on Dupont Circle, with easy access to the red metro line, or a fifteen minute walk to either historic Georgetown or the White House.

Definitely give...More",300
https://www.tripadvisor.com/Hotel_Review-g28970-d84058-Reviews-or3140-The_Dupont_Circle-Washington_DC_District_of_Columbia.html,The Dupont Circle,Wonderful location,"I stayed again at The Dupont Circle Hotel when I found a good weekend rate.  This hotel's location is one of my top favorites in Washington DC because of its proximity to restaurants and shops and nightspots and the Metro (Dupont Circle, Red Line).  

I...More",152
https://www.tripadvisor.com/Hotel_Review-g28970-d84058-Reviews-or3150-The_Dupont_Circle-Washington_DC_District_of_Columbia.html,The Dupont Circle,Good Neighborhood,"I've actually been looking for an excuse to stay The Dupont Circle Hotel for some time.  Just to experience the neighborhood.

In my opinion the hotel's location is key to it's sucess.  Very close to the metro (Red Line Dupont Circle stop) and trendy bustling...More",58
https://www.tripadvisor.com/Hotel_Review-g28970-d84058-Reviews-or3165-The_Dupont_Circle-Washington_DC_District_of_Columbia.html,The Dupont Circle,Really good breakfasts!,A pleasant hotel in the heart of Du Pont - just on the circle. A sort walk to the White House and Mall. Service was friendly and internet access free. The breakfasts (not included in the room price) were very nice - the poached eggs...More,5
https://www.tripadvisor.com/Hotel_Review-g28970-d84058-Reviews-or3190-The_Dupont_Circle-Washington_DC_District_of_Columbia.html,The Dupont Circle,It'll do!,"I came here on business as a solo traveler. It is close to all the major amenities.  I can't say enough how great the location is.

This is a nice trendy boutique hotel, with a nice upscale lobby. It is very clean and comfortable and...More",419
https://www.tripadvisor.com/Hotel_Review-g28970-d84058-Reviews-or3190-The_Dupont_Circle-Washington_DC_District_of_Columbia.html,The Dupont Circle,Luxurious and stylish...plus an excellent location!,"I stayed here for a weekend on a business trip and was very comfortable here. There was no view from my room to speak of but it was stylishly presented and the bed was incredibly comfortable. There was an ipod dock, free wireless, TV and...More",122
https://www.tripadvisor.com/Hotel_Review-g28970-d84058-Reviews-or3200-The_Dupont_Circle-Washington_DC_District_of_Columbia.html,The Dupont Circle,Fanstatic Hotel Right on Dupont Circle!!,"Like this other couple--we also in DC for our 1st anniversary over Labor Day wknd.  They also checked us in 2 hrs early with no problem.  The Concierge--Lynn was very helpful!! 
The Lobby was very clean and stylish--Loved it.  The Restaurant/bar looked very cool but...More",55
https://www.tripadvisor.com/Hotel_Review-g28970-d84058-Reviews-or3220-The_Dupont_Circle-Washington_DC_District_of_Columbia.html,The Dupont Circle,Good for business traveler and couples,"The reviews on this place were all over the place when I was deciding on it, I felt I had to weigh in with my opinion.  The Dupont Circle Hotel is probably more suited for the business traveler or a couple.  I wouldn't recommend it...More",34
https://www.tripadvisor.com/Hotel_Review-g28970-d84058-Reviews-or3220-The_Dupont_Circle-Washington_DC_District_of_Columbia.html,The Dupont Circle,"Class, Class, Class","The Dupont Circle Hotel is part of the Doyle Collection of hotels. It exudes class from the minute you enter. And then some more,,,,,   We had the extra pleasure of Level 9.  This section of the hotel is described as a hotel within a hotel....More",138
https://www.tripadvisor.com/Hotel_Review-g28970-d84058-Reviews-or3225-The_Dupont_Circle-Washington_DC_District_of_Columbia.html,The Dupont Circle,A Great Hotel for our 40th Anniversary,"We have stayed in this hotel through several iterations over the years, so it only seemed right to go back for our 40th anniversary.  We find the latest re-do  true mimimalist decor - but the beds were comfortable, the shower was fine and the location...More",90
https://www.tripadvisor.com/Hotel_Review-g28970-d84058-Reviews-or3230-The_Dupont_Circle-Washington_DC_District_of_Columbia.html,The Dupont Circle,Hot and bright a recipe for no sleep.,"The rooms were well sized and nicely appointed.  After reading other reviews I was anticipating a see through shower space--not the case.  The bathroom door is frosted glass and then the shower is past another marble half wall.  I thought it was plenty private.  

However,...More",2
https://www.tripadvisor.com/Hotel_Review-g28970-d84058-Reviews-or3255-The_Dupont_Circle-Washington_DC_District_of_Columbia.html,The Dupont Circle,Modern and Stylish hotel in the heart of DC,"I stayed here for the weekend arriving Friday and leaving Sunday; I don’t have a bad word to say against the hotel at all. 
Great first impression with the clean, stylish hotel lobby, with efficient staff on hand. My room was amazing, I couldn’t have...More",6
https://www.tripadvisor.com/Hotel_Review-g28970-d84058-Reviews-or3265-The_Dupont_Circle-Washington_DC_District_of_Columbia.html,The Dupont Circle,"Great location, stylish hotel","Newly renovated.  Very modern and elegant.  The rooms were beautiful, quite and comfortable.  The staff at the front desk and at room service were very friendly and courteous.  It is right on the circle, so close to the Metro, across from Kramer's Books (my favorite...More",35
https://www.tripadvisor.com/Hotel_Review-g28970-d84058-Reviews-or3275-The_Dupont_Circle-Washington_DC_District_of_Columbia.html,The Dupont Circle,"Perfect Location, Hip n Happening","This boutique hotel is right on Dupont Circle....in a great neighbourhood with tons of restaurants, embassy mansions, a 24 hour pharmacy, gardens etc. We only had to take the metro a few times as you can walk everywhere (cabs and traffic are a nightmare in...More",24
https://www.tripadvisor.com/Hotel_Review-g28970-d84058-Reviews-or3285-The_Dupont_Circle-Washington_DC_District_of_Columbia.html,The Dupont Circle,How many beds can you fit in a tiny room?,"Nice hotel, if a bit too modern for my liking, but will someone please tell me who planned the bedrooms? I think they measured wrong when ordering the beds. Our room had two queen beds in and barely enough space to squeeze through from the...More",15
https://www.tripadvisor.com/Hotel_Review-g28970-d84058-Reviews-or3285-The_Dupont_Circle-Washington_DC_District_of_Columbia.html,The Dupont Circle,Worst sleep I've ever had in a hotel,"The hotel is in a great location, with a good bar downstairs, which is really convenient. I would recommend visiting the bar and staying elsewhere. There is a great brunch, but again just come for brunch. You don't need to book a room here. 
 I...More",48
https://www.tripadvisor.com/Hotel_Review-g28970-d84058-Reviews-or3300-The_Dupont_Circle-Washington_DC_District_of_Columbia.html,The Dupont Circle,Studio Suite Beautiful but Service Inconsistent,"I booked a Studio Suite through Expedia at the Dupont Hotel and when I first checked in, the place exceeded my expectations, gorgeous room, but it left a bad taste when it started out amazing and then the whole experience went downhill.

So at first...More",2
https://www.tripadvisor.com/Hotel_Review-g28970-d84058-Reviews-or3340-The_Dupont_Circle-Washington_DC_District_of_Columbia.html,The Dupont Circle,Best Hotel in Washington,"We were very pleased with our stay at the Dupont and will return next time we are in Washington.  We went as a couple in our late twenties, so this review is probably most appropriate for a similar trip.

Do yourself a favor and stay...More",5
https://www.tripadvisor.com/Hotel_Review-g28970-d84058-Reviews-or3350-The_Dupont_Circle-Washington_DC_District_of_Columbia.html,None,Great hotel with some room for improvement,"I stayed at the Dupont Hotel for 5 nights in mid September.  As many of the other guests indicated, some of the positives with the Dupont Hotel are (1) great location within close proximity to a CVS and with many options for dining, (2) up-to-date...More",21
https://www.tripadvisor.com/Hotel_Review-g28970-d84058-Reviews-or3360-The_Dupont_Circle-Washington_DC_District_of_Columbia.html,The Dupont Circle,So Convenient To It All,We just returned from a long weekend at the Dupont and were very happy with our stay.  We did book one of the smaller rooms and you need to take into consideration that you will be in very close proximity to the other person or...More,9
https://www.tripadvisor.com/Hotel_Review-g28970-d84058-Reviews-or3360-The_Dupont_Circle-Washington_DC_District_of_Columbia.html,The Dupont Circle,Great location - Best value for money,"This hotel is just awesome. The modern European design and the young dedicated multi-cultural staff make the stay most comfortable. The rooms are well decorated and offer any amenities. The food is great starting with breakfast, thru Lunch up to the happy hour (nice bar...More",59
https://www.tripadvisor.com/Hotel_Review-g28970-d84058-Reviews-or3380-The_Dupont_Circle-Washington_DC_District_of_Columbia.html,The Dupont Circle,"Spacious rooms, great location, reasonable value.","What is now the Dupont has been through many personality changes. Now entirely renovated in early 21st century style it's not hugely expensive by DC standards and ideally located for the metro and a huge collection of restaurants. Reception staff were very friendly, public areas...More",15
https://www.tripadvisor.com/Hotel_Review-g28970-d84058-Reviews-or3385-The_Dupont_Circle-Washington_DC_District_of_Columbia.html,The Dupont Circle,Perfect place to stay to see DC,"Loved the Dupont Hotel!  It is in a great location close to the Metro making it easy to get to the sites but also makes you see a real DC neighborhood away from the mobs of tourists.  The room, though small are very nicely decorated...More",33
https://www.tripadvisor.com/Hotel_Review-g28970-d84058-Reviews-or3390-The_Dupont_Circle-Washington_DC_District_of_Columbia.html,The Dupont Circle,Lovely modern hotel in great location,"Stayed at the Dupont for 4 nights,got a great deal on Travel Rebublic.
Good points.
Very clean,lovely comfy bed & bed linen
Small but well appointed room.Flat sreen tv
Bathroom was very modern,as I was there with my husband I did not havea problem with...More",29
https://www.tripadvisor.com/Hotel_Review-g28970-d84058-Reviews-or3395-The_Dupont_Circle-Washington_DC_District_of_Columbia.html,The Dupont Circle,I would have liked it better if I had not stayed there so long,"Everything previously reviewed good about the hotel on the most part we agree, perfect location, the room was lovely but small along with the issue with the shower and the water but we booked knowing that so, those are non issues.  However the consistent problem...More",150
https://www.tripadvisor.com/Hotel_Review-g28970-d84058-Reviews-or3400-The_Dupont_Circle-Washington_DC_District_of_Columbia.html,The Dupont Circle,Loved the Dupont Hotel,"I booked the Dupont Hotel via Hotwire and got a great deal ($109 a night).  Had read some mixed reviews and wasn't sure what to expect but was pleasantly surprised.  We stayed at the Dupont Hotel from May 27 through June 1, 2010.  

I tend...More",18
https://www.tripadvisor.com/Hotel_Review-g28970-d84058-Reviews-or3405-The_Dupont_Circle-Washington_DC_District_of_Columbia.html,The Dupont Circle,"Great hotel with modern decorations, convenient locations and good services","The staff are very good and polite. The room is very clean, large and comfortable. I like the radio/clock with the dock to charge my IPhone/IPod. The complimentary shampoo, conditioner, lotion are very good too. The hotel is near the metro station and there are...More",3
https://www.tripadvisor.com/Hotel_Review-g28970-d84058-Reviews-or3460-The_Dupont_Circle-Washington_DC_District_of_Columbia.html,The Dupont Circle,Nice Oasis Among DC's Pricey Hotels,"My husband and I stayed at the Dupont Hotel from September 5 - 7, 2009 over the Labor Day holiday.  We actually live in the DC area but wanted to visit a bunch of museums and sites and preferred to cut down our travel time...More",236
https://www.tripadvisor.com/Hotel_Review-g28970-d84058-Reviews-or3465-The_Dupont_Circle-Washington_DC_District_of_Columbia.html,The Dupont Circle,Good experience,Our six night stay at the Dupont in late July was marked by only one problem. A malfunctioning AC unit required switching rooms (on the same floor) within the first hour of arrival. The first room was larger than the second (see pictures) and in...More,15
https://www.tripadvisor.com/Hotel_Review-g28970-d84058-Reviews-or3480-The_Dupont_Circle-Washington_DC_District_of_Columbia.html,The Dupont Circle,The Fourth in D.C.,"We were fortunate enough to book our stay at a deep discount from cheaprooms.com. When we arrived the valet was prompt, the front desk staff courteous, and the room clean and stylish. My husband and I agree we would return to the Dupont for future...More",1
https://www.tripadvisor.com/Hotel_Review-g28970-d84058-Reviews-or3485-The_Dupont_Circle-Washington_DC_District_of_Columbia.html,The Dupont Circle,A simple yet sophisticated hotel,We stayed here for three nights in May. We stayed in a studio suite which was modern and gorgeous. Panoramic views of the park and some of the city. I read some of the reviews that stated the hotel is still not ready for guests....More,8
https://www.tripadvisor.com/Hotel_Review-g28970-d84058-Reviews-or3485-The_Dupont_Circle-Washington_DC_District_of_Columbia.html,The Dupont Circle,May be better in the future but still a lot more work to do,"I wish I had read more of the recent reviews here because they are all correct.  We checked into the Dupont Hotel on a Tuesday with a stay until Sunday.  The location of the hotel, and the fact that it had a fitness center were...More",110
